{
  "schema_version": 1,
  "asset_id": "synthetic-project",
  "asset_version": "1.0.0",
  "components": [{"path": ".", "asset_type": "ASSET-009"}],
  "compliance_evidence": {
    "knowledge_base_transformed": {"status": "not_applicable", "reference": null},
    "model_finetuned": {"status": "not_applicable", "reference": null},
    "third_party_authorizations": []
  }
}
